{
  "$schema": "https://json-schema.org/draft/2020-12/schema",
  "$id": "https://decision-making-tool.local/schemas/blob-layer-manifest.schema.json",
  "title": "DISES Runtime Layer Manifest",
  "type": "object",
  "additionalProperties": false,
  "required": [
    "version",
    "generatedAt",
    "publicBlobHost",
    "sourceCsv",
    "categories",
    "layers",
    "solutions"
  ],
  "allOf": [
    {
      "if": {
        "required": ["releaseId"]
      },
      "then": {
        "required": ["catalogVersion"]
      }
    },
    {
      "if": {
        "required": ["catalogVersion"]
      },
      "then": {
        "required": ["releaseId"]
      }
    }
  ],
  "properties": {
    "version": {
      "type": "string"
    },
    "generatedAt": {
      "type": "string",
      "format": "date-time"
    },
    "publicBlobHost": {
      "type": "string",
      "format": "uri"
    },
    "sourceCsv": {
      "type": "string"
    },
    "releaseId": {
      "type": "string",
      "pattern": "^[a-z0-9]+(?:-[a-z0-9]+)*$"
    },
    "catalogVersion": {
      "type": "string",
      "pattern": "^(0|[1-9][0-9]*)\\.(0|[1-9][0-9]*)\\.(0|[1-9][0-9]*)(?:-[0-9A-Za-z-]+(?:\\.[0-9A-Za-z-]+)*)?(?:\\+[0-9A-Za-z-]+(?:\\.[0-9A-Za-z-]+)*)?$"
    },
    "solutionDataProfile": {
      "type": "string",
      "enum": ["runtime-compact-v1"]
    },
    "manualEdit": {
      "$ref": "#/$defs/manualEdit"
    },
    "categories": {
      "type": "array",
      "minItems": 1,
      "items": {
        "$ref": "#/$defs/category"
      }
    },
    "layers": {
      "type": "array",
      "items": {
        "$ref": "#/$defs/layer"
      }
    },
    "solutions": {
      "type": "array",
      "items": {
        "$ref": "#/$defs/solution"
      }
    },
    "hydrationPackage": {
      "$ref": "#/$defs/hydrationPackage"
    },
    "referenceData": {
      "type": "object"
    }
  },
  "$defs": {
    "hydrationAsset": {
      "type": "object",
      "additionalProperties": false,
      "required": ["pathname"],
      "properties": {
        "pathname": {
          "type": "string",
          "minLength": 1
        },
        "url": {
          "type": "string",
          "format": "uri"
        },
        "sha256": {
          "type": "string",
          "pattern": "^[a-f0-9]{64}$"
        },
        "sizeBytes": {
          "type": "integer",
          "minimum": 1
        }
      }
    },
    "hydrationPackage": {
      "type": "object",
      "additionalProperties": false,
      "required": ["format", "defaultReferenceGrid", "referenceGrids", "metricLayers", "sirap"],
      "properties": {
        "format": {
          "const": "dmt-hydration-package/v1"
        },
        "defaultReferenceGrid": {
          "const": "land-solution"
        },
        "speciesBitsetIndex": {
          "$ref": "#/$defs/hydrationAsset"
        },
        "referenceGrids": {
          "type": "object",
          "required": ["land-solution"],
          "additionalProperties": {
            "type": "object"
          }
        },
        "metricLayers": {
          "type": "object",
          "minProperties": 1,
          "additionalProperties": {
            "type": "object",
            "required": ["pathname"],
            "properties": {
              "pathname": { "type": "string", "minLength": 1 },
              "url": { "type": "string", "format": "uri" },
              "alignmentClass": { "type": "string" }
            }
          }
        },
        "sirap": {
          "type": "object",
          "required": ["releaseId"],
          "properties": {
            "releaseId": { "type": "string", "minLength": 1 },
            "packetManifests": { "type": "object" }
          }
        }
      }
    },
    "nullableString": {
      "type": ["string", "null"]
    },
    "manualEdit": {
      "type": "object",
      "additionalProperties": false,
      "required": ["editorName", "editedAt"],
      "properties": {
        "editorName": {
          "type": "string",
          "minLength": 1
        },
        "editedAt": {
          "type": "string",
          "format": "date-time"
        },
        "source": {
          "$ref": "#/$defs/nullableString"
        }
      }
    },
    "categoryPath": {
      "type": "string",
      "description": "Either a bare category id (e.g. \"ecosystems\") or \"categoryId.subcategoryId\".",
      "pattern": "^[a-z0-9]+(?:_[a-z0-9]+)*(?:\\.[a-z0-9]+(?:_[a-z0-9]+)*)?$"
    },
    "colorDefaults": {
      "type": "object",
      "additionalProperties": false,
      "properties": {
        "selectedColor": {
          "type": ["string", "null"],
          "pattern": "^#[0-9a-fA-F]{6}$"
        },
        "startColor": {
          "type": ["string", "null"],
          "pattern": "^#[0-9a-fA-F]{6}$"
        },
        "endColor": {
          "type": ["string", "null"],
          "pattern": "^#[0-9a-fA-F]{6}$"
        }
      }
    },
    "nullableNumber": {
      "type": ["number", "null"]
    },
    "category": {
      "type": "object",
      "additionalProperties": false,
      "required": ["id", "spanishLabel", "layerIds"],
      "properties": {
        "id": {
          "type": "string",
          "pattern": "^[A-Za-z0-9][A-Za-z0-9._+()\\-]*$"
        },
        "spanishLabel": {
          "type": "string"
        },
        "englishLabel": {
          "$ref": "#/$defs/nullableString"
        },
        "styleDefaults": {
          "$ref": "#/$defs/colorDefaults"
        },
        "subcategories": {
          "type": "array",
          "items": {
            "$ref": "#/$defs/subcategory"
          }
        },
        "layerIds": {
          "type": "array",
          "items": {
            "type": "string"
          }
        }
      }
    },
    "subcategory": {
      "type": "object",
      "additionalProperties": false,
      "required": ["id", "spanishLabel", "layerIds"],
      "properties": {
        "id": {
          "type": "string",
          "pattern": "^[a-z0-9]+(?:_[a-z0-9]+)*$"
        },
        "spanishLabel": {
          "type": "string"
        },
        "englishLabel": {
          "$ref": "#/$defs/nullableString"
        },
        "styleDefaults": {
          "$ref": "#/$defs/colorDefaults"
        },
        "layerIds": {
          "type": "array",
          "items": {
            "type": "string"
          }
        }
      }
    },
    "layer": {
      "type": "object",
      "additionalProperties": false,
      "required": [
        "id",
        "spanishLabel",
        "description",
        "tooltip",
        "dataRole",
        "category",
        "roleInMetricCalculation",
        "metadataUrl",
        "compressedDataForLiveMetricsUrl",
        "precomputedMetricUrls",
        "rendering"
      ],
      "properties": {
        "id": {
          "type": "string",
          "pattern": "^[a-z0-9]+(?:_[a-z0-9]+)*$"
        },
        "spanishLabel": {
          "type": "string"
        },
        "englishLabel": {
          "$ref": "#/$defs/nullableString"
        },
        "description": {
          "type": "string"
        },
        "tooltip": {
          "$ref": "#/$defs/nullableString"
        },
        "dataRole": {
          "type": "string",
          "enum": [
            "feature_layer",
            "manifest_for_species_layers",
            "species_layer",
            "cost_layer",
            "include_layer",
            "solution_layer",
            "administrative_boundary",
            "reference_layer"
          ]
        },
        "category": {
          "$ref": "#/$defs/categoryPath"
        },
        "roleInMetricCalculation": {
          "type": "string",
          "enum": [
            "none",
            "data_used_for_live_metric_calculation",
            "boundary_used_for_precomputed_metric_lookup",
            "data_used_for_live_metric_calculation_and_precomputed_metric_lookup"
          ]
        },
        "requiredForSolution": {
          "type": "boolean"
        },
        "selectableInFinder": {
          "type": "boolean"
        },
        "visibleInMapLayers": {
          "type": "boolean"
        },
        "sirapId": {
          "$ref": "#/$defs/nullableString"
        },
        "displayUrl": {
          "$ref": "#/$defs/nullableString"
        },
        "displayCogUrl": {
          "$ref": "#/$defs/nullableString"
        },
        "displayCollectionUrl": {
          "$ref": "#/$defs/nullableString"
        },
        "speciesManifestUrl": {
          "$ref": "#/$defs/nullableString"
        },
        "metadataUrl": {
          "$ref": "#/$defs/nullableString"
        },
        "compressedDataForLiveMetricsUrl": {
          "$ref": "#/$defs/nullableString"
        },
        "precomputedMetricUrls": {
          "type": "object",
          "additionalProperties": {
            "type": "string"
          }
        },
        "rendering": {
          "$ref": "#/$defs/rendering"
        },
        "styleOverride": {
          "type": ["boolean", "null"]
        }
      },
      "oneOf": [
        {
          "required": ["displayUrl"]
        },
        {
          "required": ["displayCollectionUrl"]
        }
      ]
    },
    "solution": {
      "type": "object",
      "additionalProperties": false,
      "required": [
        "id",
        "name",
        "description",
        "scope",
        "displayUrl",
        "metadataUrl",
        "rasterFile",
        "metadataFile",
        "blobPath",
        "generatedAt",
        "finderInputs",
        "inputLayerIds",
        "summaryMetrics",
        "coverage",
        "rendering"
      ],
      "properties": {
        "id": {
          "type": "string",
          "pattern": "^[a-z0-9]+(?:_[a-z0-9]+)*$"
        },
        "name": {
          "type": "string"
        },
        "description": {
          "type": "string"
        },
        "domain": {
          "type": "string",
          "enum": ["land", "marine"]
        },
        "scope": {
          "type": "string"
        },
        "sirapId": {
          "$ref": "#/$defs/nullableString"
        },
        "displayUrl": {
          "type": "string",
          "format": "uri"
        },
        "displayCogUrl": {
          "type": ["string", "null"],
          "format": "uri"
        },
        "metadataUrl": {
          "type": "string",
          "format": "uri"
        },
        "rasterFile": {
          "type": "string"
        },
        "metadataFile": {
          "type": "string"
        },
        "blobPath": {
          "type": "string"
        },
        "rasterSha256": {
          "type": "string",
          "pattern": "^[0-9a-f]{64}$"
        },
        "generatedAt": {
          "$ref": "#/$defs/nullableString"
        },
        "capabilities": {
          "$ref": "#/$defs/solutionCapabilities"
        },
        "precomputedMetricUrls": {
          "$ref": "#/$defs/solutionPrecomputedMetricUrls",
          "default": {}
        },
        "finderInputs": {
          "$ref": "#/$defs/solutionFinderInputs"
        },
        "inputLayerIds": {
          "$ref": "#/$defs/solutionInputLayerIds"
        },
        "summaryMetrics": {
          "$ref": "#/$defs/solutionSummaryMetrics"
        },
        "coverage": {
          "type": "array",
          "items": {
            "$ref": "#/$defs/solutionCoverageRow"
          }
        },
        "rendering": {
          "$ref": "#/$defs/rendering"
        }
      }
    },
    "solutionCapabilities": {
      "type": "object",
      "additionalProperties": false,
      "properties": {
        "aoiCoverageMetrics": {
          "const": "v2"
        }
      }
    },
    "solutionPrecomputedMetricUrls": {
      "type": "object",
      "properties": {
        "mecByGeography": {
          "$ref": "#/$defs/mecGeographyUrls"
        },
        "mecV2ByGeography": {
          "$ref": "#/$defs/mecGeographyUrls"
        },
        "mesaEcosystemByGeography": {
          "$ref": "#/$defs/mecGeographyUrls"
        },
        "mecNationalDenominator": {
          "type": "string",
          "format": "uri"
        }
      },
      "additionalProperties": {
        "type": "string"
      }
    },
    "mecGeographyUrls": {
      "type": "object",
      "additionalProperties": false,
      "required": ["national", "departments", "municipalities", "siraps", "runaps", "omecs"],
      "properties": {
        "national": {
          "type": "string",
          "format": "uri"
        },
        "departments": {
          "type": "string",
          "format": "uri"
        },
        "municipalities": {
          "type": "string",
          "format": "uri"
        },
        "siraps": {
          "type": "string",
          "format": "uri"
        },
        "runaps": {
          "type": "string",
          "format": "uri"
        },
        "omecs": {
          "type": "string",
          "format": "uri"
        }
      }
    },
    "solutionFinderInputs": {
      "type": "object",
      "additionalProperties": false,
      "required": [
        "scope",
        "targetFeatureSet",
        "targetFeatureIds",
        "targetPercent",
        "costLayerId",
        "includeLayerIds",
        "excludeLayerIds"
      ],
      "properties": {
        "domain": {
          "type": "string",
          "enum": ["land", "marine"]
        },
        "scope": {
          "type": "string"
        },
        "targetFeatureSet": {
          "$ref": "#/$defs/nullableString"
        },
        "targetFeatureIds": {
          "type": "array",
          "items": {
            "type": "string"
          }
        },
        "targetPercent": {
          "$ref": "#/$defs/nullableNumber"
        },
        "structuredTargets": {
          "$ref": "#/$defs/solutionStructuredTargets"
        },
        "costLayerId": {
          "$ref": "#/$defs/nullableString"
        },
        "includeLayerIds": {
          "type": "array",
          "items": {
            "type": "string"
          }
        },
        "excludeLayerIds": {
          "type": "array",
          "items": {
            "type": "string"
          }
        }
      }
    },
    "solutionTargetEntry": {
      "type": "object",
      "additionalProperties": false,
      "required": ["featureId", "targetPercent"],
      "properties": {
        "featureId": {
          "type": "string",
          "minLength": 1
        },
        "targetPercent": {
          "type": "number",
          "minimum": 0,
          "maximum": 100
        }
      }
    },
    "solutionStructuredTargets": {
      "type": "object",
      "additionalProperties": false,
      "required": [
        "format",
        "sourceEvaluation",
        "ecosystems",
        "strategicEcosystems",
        "ecosystemServices",
        "speciesRepresentation",
        "espRn"
      ],
      "properties": {
        "format": {
          "const": "solution-target-metadata-v1"
        },
        "sourceEvaluation": {
          "type": "string",
          "enum": ["prioritizr_model", "final_summary_csv", "legacy-single-ecosystem"]
        },
        "ecosystems": {
          "$ref": "#/$defs/solutionTargetEntries"
        },
        "strategicEcosystems": {
          "$ref": "#/$defs/solutionTargetEntries"
        },
        "ecosystemServices": {
          "$ref": "#/$defs/solutionTargetEntries"
        },
        "speciesRepresentation": {
          "$ref": "#/$defs/solutionTargetEntries"
        },
        "espRn": {
          "$ref": "#/$defs/solutionTargetEntries"
        }
      }
    },
    "solutionTargetEntries": {
      "type": "array",
      "items": {
        "$ref": "#/$defs/solutionTargetEntry"
      }
    },
    "solutionInputLayerIds": {
      "type": "object",
      "additionalProperties": false,
      "required": ["features", "cost", "includes", "excludes"],
      "properties": {
        "features": {
          "type": "array",
          "items": {
            "type": "string"
          }
        },
        "cost": {
          "$ref": "#/$defs/nullableString"
        },
        "includes": {
          "type": "array",
          "items": {
            "type": "string"
          }
        },
        "excludes": {
          "type": "array",
          "items": {
            "type": "string"
          }
        }
      }
    },
    "solutionSummaryMetrics": {
      "type": "object",
      "additionalProperties": false,
      "required": ["nSelected", "totalCost", "pctTargetsMet", "coverageRowCount"],
      "properties": {
        "nSelected": {
          "$ref": "#/$defs/nullableNumber"
        },
        "totalCost": {
          "$ref": "#/$defs/nullableNumber"
        },
        "pctTargetsMet": {
          "$ref": "#/$defs/nullableNumber"
        },
        "coverageRowCount": {
          "type": "number"
        }
      }
    },
    "solutionCoverageRow": {
      "type": "object",
      "additionalProperties": false,
      "required": ["feature", "met", "relativeTarget", "relativeHeld", "relativeShortfall"],
      "properties": {
        "feature": {
          "type": "string"
        },
        "met": {
          "type": ["boolean", "null"]
        },
        "relativeTarget": {
          "$ref": "#/$defs/nullableNumber"
        },
        "relativeHeld": {
          "$ref": "#/$defs/nullableNumber"
        },
        "relativeShortfall": {
          "$ref": "#/$defs/nullableNumber"
        },
        "type": {
          "$ref": "#/$defs/nullableString"
        },
        "evaluated": {
          "$ref": "#/$defs/nullableString"
        },
        "targetDimension": {
          "$ref": "#/$defs/nullableString"
        }
      }
    },
    "classColor": {
      "type": "object",
      "additionalProperties": false,
      "required": ["value", "color"],
      "properties": {
        "value": {
          "type": "number"
        },
        "color": {
          "type": "string",
          "pattern": "^#[0-9a-fA-F]{6}$"
        },
        "label": {
          "$ref": "#/$defs/nullableString"
        }
      }
    },
    "rendering": {
      "type": "object",
      "additionalProperties": false,
      "required": ["valueType", "renderMode"],
      "properties": {
        "valueType": {
          "type": "string",
          "enum": ["binary", "categorical", "continuous"]
        },
        "renderMode": {
          "type": "string",
          "enum": ["mask", "gradient", "categorical"]
        },
        "noDataValue": {
          "type": ["number", "null"]
        },
        "selectedValue": {
          "type": ["number", "null"]
        },
        "selectedColor": {
          "type": ["string", "null"],
          "pattern": "^#[0-9a-fA-F]{6}$"
        },
        "minValue": {
          "type": ["number", "null"]
        },
        "maxValue": {
          "type": ["number", "null"]
        },
        "startColor": {
          "type": ["string", "null"],
          "pattern": "^#[0-9a-fA-F]{6}$"
        },
        "endColor": {
          "type": ["string", "null"],
          "pattern": "^#[0-9a-fA-F]{6}$"
        },
        "classColors": {
          "type": "array",
          "items": {
            "$ref": "#/$defs/classColor"
          }
        }
      }
    }
  }
}
