{
  "version": "0.2.0",
  "generatedAt": "2026-05-09T00:21:38.193Z",
  "publicBlobHost": "https://aagibolq28slyfof.public.blob.vercel-storage.com",
  "sourceCsv": "data/Capas de entrada _ Input Layers - Capas de entrada requeridas (2).csv",
  "categories": [
    {
      "id": "ecosystems",
      "spanishLabel": "Ecosistemas",
      "englishLabel": "Ecosystems",
      "styleDefaults": {
        "selectedColor": "#166534",
        "startColor": "#bbf7d0",
        "endColor": "#166534"
      },
      "layerIds": ["paramos", "wetlands", "bosque_seco", "mangroves", "ecosistemas"]
    },
    {
      "id": "species_and_biodiversity",
      "spanishLabel": "Especies y biodiversidad",
      "englishLabel": "Species & Biodiversity",
      "styleDefaults": {
        "selectedColor": "#854d0e",
        "startColor": "#fef3c7",
        "endColor": "#854d0e"
      },
      "subcategories": [
        {
          "id": "felidae",
          "spanishLabel": "Felidae",
          "englishLabel": "Felidae",
          "styleDefaults": {
            "selectedColor": "#854d0e",
            "startColor": "#fef3c7",
            "endColor": "#854d0e"
          },
          "layerIds": []
        }
      ],
      "layerIds": ["species_richness", "species"]
    },
    {
      "id": "management_figures",
      "spanishLabel": "Figuras de manejo",
      "englishLabel": "Management Figures",
      "styleDefaults": {
        "selectedColor": "#3730a3",
        "startColor": "#e0e7ff",
        "endColor": "#3730a3"
      },
      "layerIds": ["runap", "omecs"]
    },
    {
      "id": "administrative_boundaries",
      "spanishLabel": "Límites administrativos",
      "englishLabel": "Administrative Boundaries",
      "styleDefaults": {
        "selectedColor": "#111827",
        "startColor": "#e5e7eb",
        "endColor": "#111827"
      },
      "layerIds": ["siraps", "admin_departments", "admin_municipalities"]
    },
    {
      "id": "socioeconomic",
      "spanishLabel": "Socioeconómico",
      "englishLabel": "Socio-economic",
      "styleDefaults": {
        "selectedColor": "#991b1b",
        "startColor": "#fee2e2",
        "endColor": "#991b1b"
      },
      "layerIds": ["human_footprint_2022", "net_benefit"]
    },
    {
      "id": "cultural_and_ethnic_territories",
      "spanishLabel": "Territorios culturales y étnicos",
      "englishLabel": "Cultural & Ethnic Territories",
      "styleDefaults": {
        "selectedColor": "#1d4ed8",
        "startColor": "#dbeafe",
        "endColor": "#1d4ed8"
      },
      "layerIds": ["comunidades", "resguardos"]
    }
  ],
  "layers": [
    {
      "id": "species_richness",
      "spanishLabel": "Riqueza de especies",
      "englishLabel": "Species Richness",
      "description": "Biodiversity richness surface summarizing ecosystem-level species richness across the country.\n\nSuperficie de riqueza de biodiversidad que resume la riqueza de especies a nivel ecosistémico en todo el país.",
      "tooltip": null,
      "dataRole": "feature_layer",
      "category": "species_and_biodiversity",
      "roleInMetricCalculation": "data_used_for_live_metric_calculation",
      "displayUrl": "https://aagibolq28slyfof.public.blob.vercel-storage.com/inputs/features/species_richness/riqueza_especies.tif",
      "metadataUrl": "https://aagibolq28slyfof.public.blob.vercel-storage.com/metadata/species_richness.metadata.json",
      "compressedDataForLiveMetricsUrl": "https://aagibolq28slyfof.public.blob.vercel-storage.com/metrics/live/species_richness.bin.gz",
      "precomputedMetricUrls": {
        "national": "https://aagibolq28slyfof.public.blob.vercel-storage.com/metrics/precomputed/species_richness/nacional.json"
      },
      "rendering": {
        "valueType": "continuous",
        "renderMode": "gradient",
        "startColor": "#fef3c7",
        "endColor": "#854d0e",
        "minValue": 815,
        "maxValue": 3562
      }
    },
    {
      "id": "species",
      "spanishLabel": "Distribuciones de especies individuales (~8751)",
      "englishLabel": "Individual Species Distributions",
      "description": "Species distribution raster collection for potential species explorer",
      "tooltip": null,
      "dataRole": "manifest_for_species_layers",
      "category": "species_and_biodiversity",
      "roleInMetricCalculation": "data_used_for_live_metric_calculation",
      "displayCollectionUrl": "https://aagibolq28slyfof.public.blob.vercel-storage.com/inputs/features/species/",
      "speciesManifestUrl": "https://aagibolq28slyfof.public.blob.vercel-storage.com/manifests/species.manifest.json",
      "metadataUrl": "https://aagibolq28slyfof.public.blob.vercel-storage.com/metadata/species.metadata.json",
      "compressedDataForLiveMetricsUrl": "https://aagibolq28slyfof.public.blob.vercel-storage.com/metrics/live/species.bin.gz",
      "precomputedMetricUrls": {
        "national": "https://aagibolq28slyfof.public.blob.vercel-storage.com/metrics/precomputed/species/nacional.json"
      },
      "rendering": {
        "valueType": "binary",
        "renderMode": "mask",
        "selectedColor": "#854d0e",
        "selectedValue": 1,
        "noDataValue": -9999
      }
    },
    {
      "id": "paramos",
      "spanishLabel": "Páramos",
      "englishLabel": null,
      "description": "Contiene la delimitación oficial de los complejos de páramo; su propósito es servir de referencia oficial para la gestión ambiental, la planificación territorial, la conservación y el manejo sostenible de los ecosistemas de alta montaña.",
      "tooltip": null,
      "dataRole": "feature_layer",
      "category": "ecosystems",
      "roleInMetricCalculation": "data_used_for_live_metric_calculation",
      "displayUrl": "https://aagibolq28slyfof.public.blob.vercel-storage.com/inputs/features/strategic/paramos.tif",
      "metadataUrl": "https://aagibolq28slyfof.public.blob.vercel-storage.com/metadata/paramos.metadata.json",
      "compressedDataForLiveMetricsUrl": "https://aagibolq28slyfof.public.blob.vercel-storage.com/metrics/live/paramos.bin.gz",
      "precomputedMetricUrls": {
        "national": "https://aagibolq28slyfof.public.blob.vercel-storage.com/metrics/precomputed/paramos/nacional.json"
      },
      "rendering": {
        "valueType": "binary",
        "renderMode": "mask",
        "selectedColor": "#fa0000",
        "selectedValue": 1,
        "noDataValue": -9999
      },
      "styleOverride": true
    },
    {
      "id": "wetlands",
      "spanishLabel": "Humedales",
      "englishLabel": "Wetlands",
      "description": "La delimitación geográfica de los humedales continentales de Colombia a escala 1:100.000.",
      "tooltip": null,
      "dataRole": "feature_layer",
      "category": "ecosystems",
      "roleInMetricCalculation": "data_used_for_live_metric_calculation",
      "displayUrl": "https://aagibolq28slyfof.public.blob.vercel-storage.com/inputs/features/strategic/humedales.tif",
      "metadataUrl": "https://aagibolq28slyfof.public.blob.vercel-storage.com/metadata/wetlands.metadata.json",
      "compressedDataForLiveMetricsUrl": "https://aagibolq28slyfof.public.blob.vercel-storage.com/metrics/live/wetlands.bin.gz",
      "precomputedMetricUrls": {
        "national": "https://aagibolq28slyfof.public.blob.vercel-storage.com/metrics/precomputed/wetlands/nacional.json"
      },
      "rendering": {
        "valueType": "binary",
        "renderMode": "mask",
        "noDataValue": 255,
        "selectedValue": 1,
        "selectedColor": "#16653c"
      }
    },
    {
      "id": "bosque_seco",
      "spanishLabel": "Bosque seco",
      "englishLabel": "Dry Forest",
      "description": "La distribución geográfica de los ecosistemas de bosque seco tropical en Colombia, elaborada a escala 1:100.000",
      "tooltip": null,
      "dataRole": "feature_layer",
      "category": "ecosystems",
      "roleInMetricCalculation": "data_used_for_live_metric_calculation",
      "displayUrl": "https://aagibolq28slyfof.public.blob.vercel-storage.com/inputs/features/strategic/bosque_seco.tif",
      "metadataUrl": "https://aagibolq28slyfof.public.blob.vercel-storage.com/metadata/bosque_seco.metadata.json",
      "compressedDataForLiveMetricsUrl": "https://aagibolq28slyfof.public.blob.vercel-storage.com/metrics/live/bosque_seco.bin.gz",
      "precomputedMetricUrls": {
        "national": "https://aagibolq28slyfof.public.blob.vercel-storage.com/metrics/precomputed/bosque_seco/nacional.json"
      },
      "rendering": {
        "valueType": "binary",
        "renderMode": "mask",
        "noDataValue": 255,
        "selectedValue": 1,
        "selectedColor": "#166526"
      }
    },
    {
      "id": "mangroves",
      "spanishLabel": "Manglares",
      "englishLabel": "Mangroves",
      "description": "Highlights mangrove ecosystems that support coastal protection and local livelihoods.",
      "tooltip": null,
      "dataRole": "feature_layer",
      "category": "ecosystems",
      "roleInMetricCalculation": "data_used_for_live_metric_calculation",
      "displayUrl": "https://aagibolq28slyfof.public.blob.vercel-storage.com/inputs/features/strategic/mangroves.tif",
      "metadataUrl": "https://aagibolq28slyfof.public.blob.vercel-storage.com/metadata/mangroves.metadata.json",
      "compressedDataForLiveMetricsUrl": "https://aagibolq28slyfof.public.blob.vercel-storage.com/metrics/live/mangroves.bin.gz",
      "precomputedMetricUrls": {
        "national": "https://aagibolq28slyfof.public.blob.vercel-storage.com/metrics/precomputed/mangroves/nacional.json"
      },
      "rendering": {
        "valueType": "binary",
        "renderMode": "mask",
        "noDataValue": 255,
        "selectedValue": 1,
        "selectedColor": "#16653d"
      }
    },
    {
      "id": "ecosistemas",
      "spanishLabel": "Ecosistemas",
      "englishLabel": "Ecosystems",
      "description": "Descripción de biomas y ecosistemas a escala 1:100.000",
      "tooltip": null,
      "dataRole": "feature_layer",